{
  "doc_id": "prov_44_0a78c5626587230a",
  "source_title": "上级政府部门",
  "source_url": "http://gdstc.gd.gov.cn/zwgk_n/zcfg/szcfg/content/post_2691348.html",
  "annotations": [
    {
      "goal": "建设和经营的外资股比限制",
      "instrument": [
        "platform"
      ],
      "target_actor": "机构",
      "strength": 1,
      "evidence_spans": [
        {
          "start": 484,
          "end": 634,
          "from_doc": "policy",
          "text": "一、进一步扩大市场准入领域。根据国家有关部署，逐步推进以下领域扩大对外开放：制造业领域放开专用车、新能源汽车制造的外资股比限制；服务业领域取消船舶设计、支线和通用飞机维修、人力资源服务机构、国际海上运输公司、铁路旅客运输公司、加油站建设和经营的外资股比限制，允许外商投资互联网上网服务营业场所、呼叫中..."
        }
      ],
      "confidence": 0.75
    },
    {
      "goal": "支持实体经济发展若干政策措施的通知》（粤府〔2017〕90号）规定享受用地有关优惠政策",
      "instrument": [
        "funding",
        "platform"
      ],
      "target_actor": "企业",
      "strength": 1,
      "evidence_spans": [
        {
          "start": 1199,
          "end": 1349,
          "from_doc": "policy",
          "text": "三、加强用地保障。制造业外商投资企业按《广东省人民政府关于印发广东省降低制造业企业成本支持实体经济发展若干政策措施的通知》（粤府〔2017〕90号）规定享受用地有关优惠政策。对实际投资金额超过10亿元的制造业外商投资项目用地和世界500强企业、全球行业龙头企业总部或地区总部（以下统称重点外资总部）自..."
        }
      ],
      "confidence": 0.75
    },
    {
      "goal": "支持外资研发机构（含企业内设研发机构",
      "instrument": [
        "funding",
        "platform"
      ],
      "target_actor": "企业",
      "strength": 1,
      "evidence_spans": [
        {
          "start": 1767,
          "end": 1917,
          "from_doc": "policy",
          "text": "四、支持研发创新。支持外资研发机构（含企业内设研发机构，下同）参与我省研发公共服务平台建设和政府科技计划项目，并享受相关配套资金扶持。2017-2022年，对认定为省级新型研发机构的外资研发机构，省财政最高资助1000万元；对认定为博士后工作站、两院院士工作站的外资研发机构，省财政最高资助100万元..."
        }
      ],
      "confidence": 0.75
    }
  ],
  "annotator": "annotator_A",
  "annotated_at": "2025-11-17T10:40:17.239903Z",
  "notes": "LLM辅助生成的示例标注（自动化脚本），需人工复核"
}